preference_key,movie_title,star_cast,rating,year,place,vote,link
1,Pelotón,"Oliver Stone (dir.), Charlie Sheen, Tom Berenger",8.043823573535262,1986,213,,/title/tt0091763/
2,Ratatouille,"Brad Bird (dir.), Brad Garrett, Lou Romano",8.043571215269012,2007,214,,/title/tt0382932/
3,En primera plana,"Tom McCarthy (dir.), Mark Ruffalo, Michael Keaton",8.041040246084489,2015,215,,/title/tt1895587/
4,Logan Wolverine,"James Mangold (dir.), Hugh Jackman, Patrick Stewart",8.040612349216424,2017,216,,/title/tt3315342/
1,Terminator,"James Cameron (dir.), Arnold Schwarzenegger, Linda Hamilton",8.040198531066272,1984,217,,/title/tt0088247/
2,Cuenta conmigo,"Rob Reiner (dir.), Wil Wheaton, River Phoenix",8.036405803411665,1986,218,,/title/tt0092005/
3,Rush: Pasión y gloria,"Ron Howard (dir.), Daniel Brühl, Chris Hemsworth",8.034965011307666,2013,219,,/title/tt1979320/
4,Poder que mata,"Sidney Lumet (dir.), Faye Dunaway, William Holden",8.034315004127528,1976,220,,/title/tt0074958/
1,Antes del atardecer,"Richard Linklater (dir.), Ethan Hawke, Julie Delpy",8.032921337532338,2004,221,,/title/tt0381681/
2,Camino salvaje,"Sean Penn (dir.), Emile Hirsch, Vince Vaughn",8.030930167082595,2007,222,,/title/tt0758758/
3,El mago de Oz,"Victor Fleming (dir.), Judy Garland, Frank Morgan",8.030193594569477,1939,223,,/title/tt0032138/
4,Los mejores años de nuestras vidas,"William Wyler (dir.), Myrna Loy, Dana Andrews",8.028471493074031,1946,224,,/title/tt0036868/
1,El exorcista,"William Friedkin (dir.), Ellen Burstyn, Max von Sydow",8.026620249716233,1973,225,,/title/tt0070047/
2,Hechizo del tiempo,"Harold Ramis (dir.), Bill Murray, Andie MacDowell",8.026551954919361,1993,226,,/title/tt0107048/
3,Los increíbles,"Brad Bird (dir.), Craig T. Nelson, Samuel L. Jackson",8.025033928173256,2004,227,,/title/tt0317705/
4,El odio,"Mathieu Kassovitz (dir.), Vincent Cassel, Hubert Koundé",8.024349908852761,1995,228,,/title/tt0113247/
1,Ser o no ser,"Ernst Lubitsch (dir.), Carole Lombard, Jack Benny",8.024311649461037,1942,229,,/title/tt0035446/
2,Piratas del Caribe: La maldición del Perla Negra,"Gore Verbinski (dir.), Johnny Depp, Geoffrey Rush",8.023574390340572,2003,230,,/title/tt0325980/
3,La canción del camino,"Satyajit Ray (dir.), Kanu Bannerjee, Karuna Bannerjee",8.023353204479386,1955,231,,/title/tt0048473/
4,Siempre a tu lado,"Lasse Hallström (dir.), Richard Gere, Joan Allen",8.022186847486331,2009,232,,/title/tt1028532/
1,La batalla de Argel,"Gillo Pontecorvo (dir.), Brahim Hadjadj, Jean Martin",8.0221108836622,1966,233,,/title/tt0058946/
2,Las viñas de la ira,"John Ford (dir.), Henry Fonda, Jane Darwell",8.021971917581332,1940,234,,/title/tt0032551/
3,Jai Bhim,"T.J. Gnanavel (dir.), Suriya, Lijo Mol Jose",8.021002030499801,2021,235,,/title/tt15097216/
4,Babam ve Oglum,"Çagan Irmak (dir.), Çetin Tekindor, Fikret Kuskan",8.020303439090945,2005,236,,/title/tt0476735/
1,Amores perros,"Alejandro G. Iñárritu (dir.), Emilio Echevarría, Gael García Bernal",8.019467874651786,2000,237,,/title/tt0245712/
2,"Rebeca, una mujer inolvidable","Alfred Hitchcock (dir.), Laurence Olivier, Joan Fontaine",8.018549760140306,1940,238,,/title/tt0032976/
3,La leyenda del indomable,"Stuart Rosenberg (dir.), Paul Newman, George Kennedy",8.017717730397571,1967,239,,/title/tt0061512/
4,The Handmaiden,"Park Chan-wook (dir.), Kim Min-hee, Ha Jung-woo",8.017675223901014,2016,240,,/title/tt4016934/
1,Los 400 golpes,"François Truffaut (dir.), Jean-Pierre Léaud, Albert Rémy",8.013304278480678,1959,241,,/title/tt0053198/
2,La novicia rebelde,"Robert Wise (dir.), Julie Andrews, Christopher Plummer",8.013240227321566,1965,242,,/title/tt0059742/
3,Sucedió una noche,"Frank Capra (dir.), Clark Gable, Claudette Colbert",8.012496268821513,1934,243,,/title/tt0025316/
4,Persona,"Ingmar Bergman (dir.), Bibi Andersson, Liv Ullmann",8.010627480741519,1966,244,,/title/tt0060827/
1,La vida de Brian,"Terry Jones (dir.), Graham Chapman, John Cleese",8.008821866579565,1979,245,,/title/tt0079470/
2,El gigante de hierro,"Brad Bird (dir.), Eli Marienthal, Harry Connick Jr.",8.00611625390989,1999,246,,/title/tt0129167/
3,Historias cruzadas,"Tate Taylor (dir.), Viola Davis, Emma Stone",8.005733800036392,2011,247,,/title/tt1454029/
4,Aladdín,"Ron Clements (dir.), Scott Weinger, Robin Williams",8.003737931284283,1992,248,,/title/tt0103639/
1,Dersu Uzala,"Akira Kurosawa (dir.), Maksim Munzuk, Yuriy Solomin",8.003155820076218,1975,249,,/title/tt0071411/
2,Danza con lobos,"Kevin Costner (dir.), Kevin Costner, Mary McDonnell",8.001560314828565,1990,250,,/title/tt0099348/
